11:31:23.326079 ARP, Request who-has OnePlus-6.umg.edu.pl tell fgw.eduroam.umg.edu.pl, length 46
11:31:23.326258 IP M2003J15SC-RedmiNote.umg.edu.pl.mdns > 224.0.0.251.mdns: 0 [1n] ANY (QM)? Android.local. (47)
11:31:23.326515 IP6 fe80::301b:f8ff:fe26:baae.mdns > ff02::fb.mdns: 0 [1n] ANY (QM)? Android.local. (47)
11:31:23.326853 IP6 fe80::301b:f8ff:fe26:baae.mdns > ff02::fb.mdns: 0 [1n] ANY (QM)? Android.local. (47)
11:31:23.327100 IP LAPTOP-C8790SDD.umg.edu.pl.mdns > 224.0.0.251.mdns: 0 A (QM)? BRW30C9AB055211.local. (39)
11:31:23.327367 IP6 fe80::f19b:6327:f3a8:e155.mdns > ff02::fb.mdns: 0 A (QM)? BRW30C9AB055211.local. (39)
11:31:23.327644 IP mbpc4159.eduroam.umg.edu.pl.mdns > 224.0.0.251.mdns: 0 PTR (QM)? _spotify-connect._tcp.local. (45)
11:31:23.328006 IP6 fe80::14b1:7f82:70fc:edf1.mdns > ff02::fb.mdns: 0 PTR (QM)? _spotify-connect._tcp.local. (45)
11:31:23.328299 IP6 fe80::f19b:6327:f3a8:e155.mdns > ff02::fb.mdns: 0 A (QM)? BRW30C9AB055211.local. (39)
11:31:23.328607 IP6 fe80::14b1:7f82:70fc:edf1.mdns > ff02::fb.mdns: 0 PTR (QM)? _spotify-connect._tcp.local. (45)
11:31:23.328865 ARP, Request who-has fgw.eduroam.umg.edu.pl tell DESKTOP-BJSFL79.umg.edu.pl, length 42
11:31:23.633280 IP6 fe80::f19b:6327:f3a8:e155.56319 > ff02::1:3.hostmon: UDP, length 33
11:31:23.633467 IP LAPTOP-C8790SDD.umg.edu.pl.56319 > 224.0.0.252.hostmon: UDP, length 33
11:31:23.634013 IP mbpc4159.eduroam.umg.edu.pl.62012 > 239.255.255.250.1900: UDP, length 125
11:31:23.634196 IP M2003J15SC-RedmiNote.umg.edu.pl.mdns > 224.0.0.251.mdns: 0 [1n] ANY (QM)? Android.local. (47)
11:31:23.634576 IP6 fe80::301b:f8ff:fe26:baae.mdns > ff02::fb.mdns: 0 [1n] ANY (QM)? Android.local. (47)
11:31:23.634910 IP6 fe80::301b:f8ff:fe26:baae.mdns > ff02::fb.mdns: 0 [1n] ANY (QM)? Android.local. (47)
11:31:23.635347 IP6 fe80::b0b6:5eef:197:baf8.dhcpv6-client > ff02::1:2.dhcpv6-server: dhcp6 solicit
11:31:23.635402 ARP, Request who-has DESKTOP-BJSFL79.umg.edu.pl tell 0.0.0.0, length 42
11:31:23.635965 IP6 fe80::b0b6:5eef:197:baf8 > ip6-allnodes: ICMP6, neighbor advertisement, tgt is fe80::b0b6:5eef:197:baf8, length 32
11:31:23.636845 ARP, Request who-has Komputer.umg.edu.pl tell fgw.eduroam.umg.edu.pl, length 46
11:31:23.637220 IP LAPTOP-F4A707N2.umg.edu.pl.51719 > 239.255.255.250.1900: UDP, length 132
11:31:23.637482 IP HUAWEI_P30_Pro-bee164877a.umg.edu.pl.mdns > 224.0.0.251.mdns: 0 [2q] [2n] ANY (QM)? Android.local. ANY (QM)? Android.local. (81)
11:31:23.638607 IP6 fe80::ef9a:1048:c1ca:3c97.mdns > ff02::fb.mdns: 0 [2q] [2n] ANY (QM)? Android.local. ANY (QM)? Android.local. (81)
11:31:23.638917 IP6 fe80::ef9a:1048:c1ca:3c97.mdns > ff02::fb.mdns: 0 [2q] [2n] ANY (QM)? Android.local. ANY (QM)? Android.local. (81)
11:31:23.639542 IP6 fe80::ef9a:1048:c1ca:3c97.mdns > ff02::fb.mdns: 0 [2q] [2n] ANY (QM)? Android.local. ANY (QM)? Android.local. (81)
11:31:23.639952 IP6 fe80::ef9a:1048:c1ca:3c97.mdns > ff02::fb.mdns: 0 [2q] [2n] ANY (QM)? Android.local. ANY (QM)? Android.local. (81)
11:31:23.640548 IP mbpc5212.eduroam.umg.edu.pl.mdns > 224.0.0.251.mdns: 0*- [0q] 4/0/3 (Cache flush) PTR Android-86.local., (Cache flush) PTR Android-86.local., (Cache flush) A 153.19.115.212, (Cache flush) AAAA fe80::30fd:32ff:fe00:a4a (251)
11:31:23.641159 IP6 fe80::30fd:32ff:fe00:a4a.mdns > ff02::fb.mdns: 0*- [0q] 4/0/3 (Cache flush) PTR Android-86.local., (Cache flush) PTR Android-86.local., (Cache flush) A 153.19.115.212, (Cache flush) AAAA fe80::30fd:32ff:fe00:a4a (251)
11:31:23.736559 IP jan-IdeaPad-L340-15IRH.umg.edu.pl.41420 > edge-star-shv-01-waw1.facebook.com.https: Flags [P.], seq 3982631759:3982631800, ack 2288458885, win 501, options [nop,nop,TS val 3372006867 ecr 2441378444], length 41
11:31:23.784346 IP edge-star-shv-01-waw1.facebook.com.https > jan-IdeaPad-L340-15IRH.umg.edu.pl.41420: Flags [P.], seq 1:38, ack 41, win 726, options [nop,nop,TS val 2441386056 ecr 3372006867], length 37
11:31:23.784394 IP jan-IdeaPad-L340-15IRH.umg.edu.pl.41420 > edge-star-shv-01-waw1.facebook.com.https: Flags [.], ack 38, win 501, options [nop,nop,TS val 3372006915 ecr 2441386056], length 0
11:31:23.940539 IP6 fe80::30fd:32ff:fe00:a4a.mdns > ff02::fb.mdns: 0*- [0q] 4/0/3 (Cache flush) PTR Android-86.local., (Cache flush) PTR Android-86.local., (Cache flush) A 153.19.115.212, (Cache flush) AAAA fe80::30fd:32ff:fe00:a4a (251)
11:31:23.941203 IP LAPTOP-C8790SDD.umg.edu.pl.netbios-ns > 153.19.115.255.netbios-ns: UDP, length 50
11:31:23.941359 IP M2003J15SC-RedmiNote.umg.edu.pl.mdns > 224.0.0.251.mdns: 0*- [0q] 1/0/1 (Cache flush) A 153.19.114.58 (61)
11:31:23.941856 IP6 fe80::301b:f8ff:fe26:baae.mdns > ff02::fb.mdns: 0*- [0q] 1/0/1 (Cache flush) A 153.19.114.58 (61)
11:31:23.942183 IP6 fe80::301b:f8ff:fe26:baae.mdns > ff02::fb.mdns: 0*- [0q] 1/0/1 (Cache flush) A 153.19.114.58 (61)
11:31:23.942484 IP LAPTOP-C8790SDD.umg.edu.pl.netbios-ns > 153.19.115.255.netbios-ns: UDP, length 50
11:31:23.943055 IP DESKTOP-ED4GRAD.umg.edu.pl.58870 > 239.255.255.250.1900: UDP, length 175
11:31:23.943439 IP DESKTOP-ED4GRAD.umg.edu.pl.58871 > 239.255.255.250.1900: UDP, length 174
11:31:23.943775 IP HUAWEI_P30_Pro-bee164877a.umg.edu.pl.mdns > 224.0.0.251.mdns: 0 [2q] [2n] ANY (QM)? Android-2.local. ANY (QM)? Android-2.local. (83)
11:31:23.944099 IP6 fe80::ef9a:1048:c1ca:3c97.mdns > ff02::fb.mdns: 0 [2q] [2n] ANY (QM)? Android-2.local. ANY (QM)? Android-2.local. (83)
11:31:23.944355 IP M2003J15SC-RedmiNote.umg.edu.pl.mdns > 224.0.0.251.mdns: 0*- [0q] 1/0/1 (Cache flush) AAAA fe80::301b:f8ff:fe26:baae (73)
11:31:23.944634 IP6 fe80::301b:f8ff:fe26:baae.mdns > ff02::fb.mdns: 0*- [0q] 1/0/1 (Cache flush) AAAA fe80::301b:f8ff:fe26:baae (73)
11:31:23.945003 IP6 fe80::ef9a:1048:c1ca:3c97.mdns > ff02::fb.mdns: 0 [2q] [2n] ANY (QM)? Android-2.local. ANY (QM)? Android-2.local. (83)
11:31:23.945409 IP6 fe80::ef9a:1048:c1ca:3c97.mdns > ff02::fb.mdns: 0 [2q] [2n] ANY (QM)? Android-2.local. ANY (QM)? Android-2.local. (83)
11:31:23.945809 IP6 fe80::301b:f8ff:fe26:baae.mdns > ff02::fb.mdns: 0*- [0q] 1/0/1 (Cache flush) AAAA fe80::301b:f8ff:fe26:baae (73)
11:31:23.946093 ARP, Request who-has mbpc5110.eduroam.umg.edu.pl tell fgw.eduroam.umg.edu.pl, length 46
11:31:23.946585 IP DESKTOP-MBRAJCB.umg.edu.pl.54915 > 153.19.115.255.54915: UDP, length 263
11:31:23.946929 IP LAPTOP-C8790SDD.umg.edu.pl.mdns > 224.0.0.251.mdns: 0 A (QM)? BRW30C9AB055211.local. (39)
11:31:23.947180 IP6 fe80::f19b:6327:f3a8:e155.mdns > ff02::fb.mdns: 0 A (QM)? BRW30C9AB055211.local. (39)
11:31:24.110881 IP jan-IdeaPad-L340-15IRH.umg.edu.pl.51566 > fgw.eduroam.umg.edu.pl.domain: 7015+ PTR? 122.114.19.153.in-addr.arpa. (45)
11:31:24.116469 IP fgw.eduroam.umg.edu.pl.domain > jan-IdeaPad-L340-15IRH.umg.edu.pl.51566: 7015* 1/0/0 PTR OnePlus-6.umg.edu.pl. (79)
11:31:24.117979 IP jan-IdeaPad-L340-15IRH.umg.edu.pl.45169 > fgw.eduroam.umg.edu.pl.domain: 61359+ PTR? 251.0.0.224.in-addr.arpa. (42)
11:31:24.120539 IP fgw.eduroam.umg.edu.pl.domain > jan-IdeaPad-L340-15IRH.umg.edu.pl.45169: 61359 NXDomain 0/1/0 (99)
11:31:24.122536 IP jan-IdeaPad-L340-15IRH.umg.edu.pl.51704 > fgw.eduroam.umg.edu.pl.domain: 37756+ PTR? 58.114.19.153.in-addr.arpa. (44)
11:31:24.124900 IP fgw.eduroam.umg.edu.pl.domain > jan-IdeaPad-L340-15IRH.umg.edu.pl.51704: 37756* 1/0/0 PTR M2003J15SC-RedmiNote.umg.edu.pl. (89)
11:31:24.126375 IP jan-IdeaPad-L340-15IRH.umg.edu.pl.45954 > fgw.eduroam.umg.edu.pl.domain: 37040+ PTR? b.f.0.0.0.0.0.0.0.0.0.0.0.0.0.0.0.0.0.0.0.0.0.0.0.0.0.0.2.0.f.f.ip6.arpa. (90)
11:31:24.128931 IP fgw.eduroam.umg.edu.pl.domain > jan-IdeaPad-L340-15IRH.umg.edu.pl.45954: 37040 NXDomain 0/1/0 (154)
11:31:24.131091 IP jan-IdeaPad-L340-15IRH.umg.edu.pl.60087 > fgw.eduroam.umg.edu.pl.domain: 46546+ PTR? e.a.a.b.6.2.e.f.f.f.8.f.b.1.0.3.0.0.0.0.0.0.0.0.0.0.0.0.0.8.e.f.ip6.arpa. (90)
11:31:24.133573 IP fgw.eduroam.umg.edu.pl.domain > jan-IdeaPad-L340-15IRH.umg.edu.pl.60087: 46546 NXDomain* 0/1/0 (139)
11:31:24.135248 IP jan-IdeaPad-L340-15IRH.umg.edu.pl.42341 > fgw.eduroam.umg.edu.pl.domain: 30210+ PTR? 196.115.19.153.in-addr.arpa. (45)
11:31:24.137589 IP fgw.eduroam.umg.edu.pl.domain > jan-IdeaPad-L340-15IRH.umg.edu.pl.42341: 30210* 1/0/0 PTR LAPTOP-C8790SDD.umg.edu.pl. (85)
11:31:24.139011 IP jan-IdeaPad-L340-15IRH.umg.edu.pl.45583 > fgw.eduroam.umg.edu.pl.domain: 26201+ PTR? 5.5.1.e.8.a.3.f.7.2.3.6.b.9.1.f.0.0.0.0.0.0.0.0.0.0.0.0.0.8.e.f.ip6.arpa. (90)
11:31:24.141580 IP fgw.eduroam.umg.edu.pl.domain > jan-IdeaPad-L340-15IRH.umg.edu.pl.45583: 26201 NXDomain* 0/1/0 (139)
11:31:24.144240 IP jan-IdeaPad-L340-15IRH.umg.edu.pl.34636 > fgw.eduroam.umg.edu.pl.domain: 21880+ PTR? 1.f.d.e.c.f.0.7.2.8.f.7.1.b.4.1.0.0.0.0.0.0.0.0.0.0.0.0.0.8.e.f.ip6.arpa. (90)
11:31:24.150714 IP fgw.eduroam.umg.edu.pl.domain > jan-IdeaPad-L340-15IRH.umg.edu.pl.34636: 21880 NXDomain* 0/1/0 (139)
11:31:24.152280 IP jan-IdeaPad-L340-15IRH.umg.edu.pl.48537 > fgw.eduroam.umg.edu.pl.domain: 62401+ PTR? 203.115.19.153.in-addr.arpa. (45)
11:31:24.154108 IP fgw.eduroam.umg.edu.pl.domain > jan-IdeaPad-L340-15IRH.umg.edu.pl.48537: 62401* 1/0/0 PTR DESKTOP-BJSFL79.umg.edu.pl. (85)
11:31:24.155583 IP jan-IdeaPad-L340-15IRH.umg.edu.pl.32904 > fgw.eduroam.umg.edu.pl.domain: 2732+ PTR? 3.0.0.0.1.0.0.0.0.0.0.0.0.0.0.0.0.0.0.0.0.0.0.0.0.0.0.0.2.0.f.f.ip6.arpa. (90)
11:31:24.158229 IP fgw.eduroam.umg.edu.pl.domain > jan-IdeaPad-L340-15IRH.umg.edu.pl.32904: 2732 NXDomain 0/1/0 (154)
11:31:24.159817 IP jan-IdeaPad-L340-15IRH.umg.edu.pl.42119 > fgw.eduroam.umg.edu.pl.domain: 27447+ PTR? 252.0.0.224.in-addr.arpa. (42)
11:31:24.163316 IP fgw.eduroam.umg.edu.pl.domain > jan-IdeaPad-L340-15IRH.umg.edu.pl.42119: 27447 NXDomain 0/1/0 (99)
11:31:24.164618 IP jan-IdeaPad-L340-15IRH.umg.edu.pl.36496 > fgw.eduroam.umg.edu.pl.domain: 4097+ PTR? 250.255.255.239.in-addr.arpa. (46)
11:31:24.167154 IP fgw.eduroam.umg.edu.pl.domain > jan-IdeaPad-L340-15IRH.umg.edu.pl.36496: 4097 NXDomain 0/1/0 (103)
11:31:24.168860 IP jan-IdeaPad-L340-15IRH.umg.edu.pl.44139 > fgw.eduroam.umg.edu.pl.domain: 45161+ PTR? 2.0.0.0.1.0.0.0.0.0.0.0.0.0.0.0.0.0.0.0.0.0.0.0.0.0.0.0.2.0.f.f.ip6.arpa. (90)
11:31:24.171450 IP fgw.eduroam.umg.edu.pl.domain > jan-IdeaPad-L340-15IRH.umg.edu.pl.44139: 45161 NXDomain 0/1/0 (154)
11:31:24.173573 IP jan-IdeaPad-L340-15IRH.umg.edu.pl.58270 > fgw.eduroam.umg.edu.pl.domain: 47416+ PTR? 8.f.a.b.7.9.1.0.f.e.e.5.6.b.0.b.0.0.0.0.0.0.0.0.0.0.0.0.0.8.e.f.ip6.arpa. (90)
11:31:24.176146 IP fgw.eduroam.umg.edu.pl.domain > jan-IdeaPad-L340-15IRH.umg.edu.pl.58270: 47416 NXDomain* 0/1/0 (139)
11:31:24.179074 IP jan-IdeaPad-L340-15IRH.umg.edu.pl.49220 > fgw.eduroam.umg.edu.pl.domain: 25371+ PTR? 100.115.19.153.in-addr.arpa. (45)
11:31:24.181343 IP fgw.eduroam.umg.edu.pl.domain > jan-IdeaPad-L340-15IRH.umg.edu.pl.49220: 25371* 1/0/0 PTR Komputer.umg.edu.pl. (78)
11:31:24.182124 IP jan-IdeaPad-L340-15IRH.umg.edu.pl.56447 > fgw.eduroam.umg.edu.pl.domain: 3633+ PTR? 185.115.19.153.in-addr.arpa. (45)
11:31:24.184497 IP fgw.eduroam.umg.edu.pl.domain > jan-IdeaPad-L340-15IRH.umg.edu.pl.56447: 3633* 1/0/0 PTR LAPTOP-F4A707N2.umg.edu.pl. (85)
11:31:24.185463 IP jan-IdeaPad-L340-15IRH.umg.edu.pl.33350 > fgw.eduroam.umg.edu.pl.domain: 51859+ PTR? 174.115.19.153.in-addr.arpa. (45)
11:31:24.188257 IP fgw.eduroam.umg.edu.pl.domain > jan-IdeaPad-L340-15IRH.umg.edu.pl.33350: 51859* 1/0/0 PTR HUAWEI_P30_Pro-bee164877a.umg.edu.pl. (95)
11:31:24.189699 IP jan-IdeaPad-L340-15IRH.umg.edu.pl.58645 > fgw.eduroam.umg.edu.pl.domain: 25875+ PTR? 7.9.c.3.a.c.1.c.8.4.0.1.a.9.f.e.0.0.0.0.0.0.0.0.0.0.0.0.0.8.e.f.ip6.arpa. (90)
11:31:24.192295 IP fgw.eduroam.umg.edu.pl.domain > jan-IdeaPad-L340-15IRH.umg.edu.pl.58645: 25875 NXDomain* 0/1/0 (139)
11:31:24.195064 IP jan-IdeaPad-L340-15IRH.umg.edu.pl.43477 > fgw.eduroam.umg.edu.pl.domain: 39208+ PTR? a.4.a.0.0.0.e.f.f.f.2.3.d.f.0.3.0.0.0.0.0.0.0.0.0.0.0.0.0.8.e.f.ip6.arpa. (90)
11:31:24.199141 IP fgw.eduroam.umg.edu.pl.domain > jan-IdeaPad-L340-15IRH.umg.edu.pl.43477: 39208 NXDomain* 0/1/0 (139)
11:31:24.201373 IP jan-IdeaPad-L340-15IRH.umg.edu.pl.32909 > fgw.eduroam.umg.edu.pl.domain: 17781+ PTR? 52.114.19.153.in-addr.arpa. (44)
11:31:24.203958 IP fgw.eduroam.umg.edu.pl.domain > jan-IdeaPad-L340-15IRH.umg.edu.pl.32909: 17781* 1/0/0 PTR jan-IdeaPad-L340-15IRH.umg.edu.pl. (91)
11:31:24.205077 IP jan-IdeaPad-L340-15IRH.umg.edu.pl.36517 > fgw.eduroam.umg.edu.pl.domain: 27368+ PTR? 255.115.19.153.in-addr.arpa. (45)
11:31:24.207457 IP fgw.eduroam.umg.edu.pl.domain > jan-IdeaPad-L340-15IRH.umg.edu.pl.36517: 27368 NXDomain* 0/1/0 (125)
11:31:24.208611 IP jan-IdeaPad-L340-15IRH.umg.edu.pl.54940 > fgw.eduroam.umg.edu.pl.domain: 24109+ PTR? 42.114.19.153.in-addr.arpa. (44)
11:31:24.210939 IP fgw.eduroam.umg.edu.pl.domain > jan-IdeaPad-L340-15IRH.umg.edu.pl.54940: 24109* 1/0/0 PTR DESKTOP-ED4GRAD.umg.edu.pl. (84)
11:31:24.212497 IP jan-IdeaPad-L340-15IRH.umg.edu.pl.58555 > fgw.eduroam.umg.edu.pl.domain: 20944+ PTR? 45.115.19.153.in-addr.arpa. (44)
11:31:24.214860 IP fgw.eduroam.umg.edu.pl.domain > jan-IdeaPad-L340-15IRH.umg.edu.pl.58555: 20944* 1/0/0 PTR DESKTOP-MBRAJCB.umg.edu.pl. (84)
11:31:24.247528 IP6 fe80::f19b:6327:f3a8:e155.mdns > ff02::fb.mdns: 0 A (QM)? BRW30C9AB055211.local. (39)
11:31:24.247825 IP mbpc4168.eduroam.umg.edu.pl.mdns > 224.0.0.251.mdns: 0*- [0q] 2/0/1 (Cache flush) A 153.19.114.168, (Cache flush) AAAA fe80::a650:46ff:fe51:e2bd (91)
11:31:24.248301 IP6 fe80::a650:46ff:fe51:e2bd.mdns > ff02::fb.mdns: 0*- [0q] 2/0/1 (Cache flush) A 153.19.114.168, (Cache flush) AAAA fe80::a650:46ff:fe51:e2bd (91)
11:31:24.248593 IP6 fe80::a650:46ff:fe51:e2bd.mdns > ff02::fb.mdns: 0*- [0q] 2/0/1 (Cache flush) A 153.19.114.168, (Cache flush) AAAA fe80::a650:46ff:fe51:e2bd (91)
11:31:24.248857 ARP, Request who-has mbpc5230.eduroam.umg.edu.pl tell fgw.eduroam.umg.edu.pl, length 46
11:31:24.249227 IP HUAWEI_P30_Pro-bee164877a.umg.edu.pl.mdns > 224.0.0.251.mdns: 0 [2q] [2n] ANY (QM)? Android-2.local. ANY (QM)? Android-2.local. (83)
11:31:24.249665 IP6 fe80::ef9a:1048:c1ca:3c97.mdns > ff02::fb.mdns: 0 [2q] [2n] ANY (QM)? Android-2.local. ANY (QM)? Android-2.local. (83)
11:31:24.250064 IP6 fe80::ef9a:1048:c1ca:3c97.mdns > ff02::fb.mdns: 0 [2q] [2n] ANY (QM)? Android-2.local. ANY (QM)? Android-2.local. (83)
11:31:24.250354 ARP, Request who-has OnePlus-6.umg.edu.pl tell fgw.eduroam.umg.edu.pl, length 46
11:31:24.250766 IP6 fe80::ef9a:1048:c1ca:3c97.mdns > ff02::fb.mdns: 0 [2q] [2n] ANY (QM)? Android-2.local. ANY (QM)? Android-2.local. (83)
11:31:24.251182 IP Air-Katarzyna.umg.edu.pl.mdns > 224.0.0.251.mdns: 0*- [0q] 2/0/3 (Cache flush) PTR MacBook-Air-Katarzyna.local., (Cache flush) PTR MacBook-Air-Katarzyna.local. (227)
11:31:24.251744 IP6 fe80::104a:2fa4:c6d3:1512.mdns > ff02::fb.mdns: 0*- [0q] 2/0/3 (Cache flush) PTR MacBook-Air-Katarzyna.local., (Cache flush) PTR MacBook-Air-Katarzyna.local. (227)
11:31:24.252349 IP6 fe80::104a:2fa4:c6d3:1512.mdns > ff02::fb.mdns: 0*- [0q] 2/0/3 (Cache flush) PTR MacBook-Air-Katarzyna.local., (Cache flush) PTR MacBook-Air-Katarzyna.local. (227)
11:31:24.252592 IP DESKTOP-4S4I5AP.umg.edu.pl.netbios-ns > 153.19.115.255.netbios-ns: UDP, length 50
11:31:24.554870 IP HUAWEI_P30_Pro-bee164877a.umg.edu.pl.mdns > 224.0.0.251.mdns: 0 [2q] [2n] ANY (QM)? Android-3.local. ANY (QM)? Android-3.local. (83)
11:31:24.555223 IP6 fe80::ef9a:1048:c1ca:3c97.mdns > ff02::fb.mdns: 0 [2q] [2n] ANY (QM)? Android-3.local. ANY (QM)? Android-3.local. (83)
11:31:24.555623 IP6 fe80::ef9a:1048:c1ca:3c97.mdns > ff02::fb.mdns: 0 [2q] [2n] ANY (QM)? Android-3.local. ANY (QM)? Android-3.local. (83)
11:31:24.556356 IP Air-Katarzyna.umg.edu.pl.mdns > 224.0.0.251.mdns: 0 [20q] [1au] PTR (QU)? lb._dns-sd._udp.local. PTR (QU)? _airport._tcp.local. PTR (QU)? _homekit._tcp.local. PTR (QU)? _googlecast._tcp.local. PTR (QU)? _rdlink._tcp.local. PTR (QU)? _uscans._tcp.local. PTR (QU)? _scanner._tcp.local. PTR (QU)? _ipp._tcp.local. PTR (QU)? _ptp._tcp.local. PTR (QU)? _printer._tcp.local. PTR (QU)? _ipps._tcp.local. PTR (QU)? _ippusb._tcp.local. PTR (QU)? _pdl-datastream._tcp.local. PTR (QU)? _uscan._tcp.local. PTR (QU)? _afpovertcp._tcp.local. PTR (QU)? _smb._tcp.local. PTR (QU)? _rfb._tcp.local. PTR (QU)? _adisk._tcp.local. PTR (QU)? _companion-link._tcp.local. PTR (QU)? _sleep-proxy._udp.local. (356)
11:31:24.557149 IP6 fe80::104a:2fa4:c6d3:1512.mdns > ff02::fb.mdns: 0 [20q] [1au] PTR (QU)? lb._dns-sd._udp.local. PTR (QU)? _airport._tcp.local. PTR (QU)? _homekit._tcp.local. PTR (QU)? _googlecast._tcp.local. PTR (QU)? _rdlink._tcp.local. PTR (QU)? _uscans._tcp.local. PTR (QU)? _scanner._tcp.local. PTR (QU)? _ipp._tcp.local. PTR (QU)? _ptp._tcp.local. PTR (QU)? _printer._tcp.local. PTR (QU)? _ipps._tcp.local. PTR (QU)? _ippusb._tcp.local. PTR (QU)? _pdl-datastream._tcp.local. PTR (QU)? _uscan._tcp.local. PTR (QU)? _afpovertcp._tcp.local. PTR (QU)? _smb._tcp.local. PTR (QU)? _rfb._tcp.local. PTR (QU)? _adisk._tcp.local. PTR (QU)? _companion-link._tcp.local. PTR (QU)? _sleep-proxy._udp.local. (356)
11:31:24.557358 IP mbpc571.eduroam.umg.edu.pl.mdns > 224.0.0.251.mdns: 0 [2q] [1au] PTR (QM)? _sleep-proxy._udp.local. PTR (QM)? _meshcop._udp.local. (85)
11:31:24.557731 IP6 fe80::b:438b:fab5:686b.mdns > ff02::fb.mdns: 0 [2q] [1au] PTR (QM)? _sleep-proxy._udp.local. PTR (QM)? _meshcop._udp.local. (85)
11:31:24.558524 IP6 fe80::104a:2fa4:c6d3:1512.mdns > ff02::fb.mdns: 0 [20q] [1au] PTR (QU)? lb._dns-sd._udp.local. PTR (QU)? _airport._tcp.local. PTR (QU)? _homekit._tcp.local. PTR (QU)? _googlecast._tcp.local. PTR (QU)? _rdlink._tcp.local. PTR (QU)? _uscans._tcp.local. PTR (QU)? _scanner._tcp.local. PTR (QU)? _ipp._tcp.local. PTR (QU)? _ptp._tcp.local. PTR (QU)? _printer._tcp.local. PTR (QU)? _ipps._tcp.local. PTR (QU)? _ippusb._tcp.local. PTR (QU)? _pdl-datastream._tcp.local. PTR (QU)? _uscan._tcp.local. PTR (QU)? _afpovertcp._tcp.local. PTR (QU)? _smb._tcp.local. PTR (QU)? _rfb._tcp.local. PTR (QU)? _adisk._tcp.local. PTR (QU)? _companion-link._tcp.local. PTR (QU)? _sleep-proxy._udp.local. (356)
11:31:24.558634 IP LAPTOP-C8790SDD.umg.edu.pl.netbios-ns > 153.19.115.255.netbios-ns: UDP, length 50
11:31:24.559040 IP6 fe80::b:438b:fab5:686b.mdns > ff02::fb.mdns: 0 [2q] [1au] PTR (QM)? _sleep-proxy._udp.local. PTR (QM)? _meshcop._udp.local. (85)
11:31:24.559350 IP LAPTOP-C8790SDD.umg.edu.pl.netbios-ns > 153.19.115.255.netbios-ns: UDP, length 50
11:31:24.559752 IP LAPTOP-C8790SDD.umg.edu.pl.mdns > 224.0.0.251.mdns: 0 A (QM)? BRW30C9AB055211.local. (39)
11:31:24.559893 IP6 fe80::f19b:6327:f3a8:e155.mdns > ff02::fb.mdns: 0 A (QM)? BRW30C9AB055211.local. (39)
11:31:24.560359 IP LAPTOP-C8790SDD.umg.edu.pl.63459 > 224.0.0.252.hostmon: UDP, length 33
11:31:24.560612 IP6 fe80::f19b:6327:f3a8:e155.mdns > ff02::fb.mdns: 0 A (QM)? BRW30C9AB055211.local. (39)
11:31:24.560944 IP6 fe80::f19b:6327:f3a8:e155.63459 > ff02::1:3.hostmon: UDP, length 33
11:31:24.561171 ARP, Request who-has DESKTOP-BJSFL79.umg.edu.pl tell 0.0.0.0, length 42
11:31:24.862047 ARP, Request who-has Komputer.umg.edu.pl tell fgw.eduroam.umg.edu.pl, length 46
11:31:24.862244 IP HUAWEI_P30_Pro-bee164877a.umg.edu.pl.mdns > 224.0.0.251.mdns: 0 [2q] [2n] ANY (QM)? Android-3.local. ANY (QM)? Android-3.local. (83)
11:31:24.862586 IP6 fe80::ef9a:1048:c1ca:3c97.mdns > ff02::fb.mdns: 0 [2q] [2n] ANY (QM)? Android-3.local. ANY (QM)? Android-3.local. (83)
11:31:24.862954 IP6 fe80::ef9a:1048:c1ca:3c97.mdns > ff02::fb.mdns: 0 [2q] [2n] ANY (QM)? Android-3.local. ANY (QM)? Android-3.local. (83)
11:31:24.863313 IP6 fe80::ef9a:1048:c1ca:3c97.mdns > ff02::fb.mdns: 0 [2q] [2n] ANY (QM)? Android-3.local. ANY (QM)? Android-3.local. (83)
11:31:24.863664 IP Air-Katarzyna.umg.edu.pl.mdns > 224.0.0.251.mdns: 0 [3q] [1au] PTR (QU)? _apple-mobdev._tcp.local. PTR (QU)? 8b4507c7._sub._apple-mobdev2._tcp.local. PTR (QU)? _apple-pairable._tcp.local. (128)
11:31:24.864189 IP6 fe80::104a:2fa4:c6d3:1512.mdns > ff02::fb.mdns: 0 [3q] [1au] PTR (QU)? _apple-mobdev._tcp.local. PTR (QU)? 8b4507c7._sub._apple-mobdev2._tcp.local. PTR (QU)? _apple-pairable._tcp.local. (128)
11:31:24.864510 IP6 fe80::ef9a:1048:c1ca:3c97.mdns > ff02::fb.mdns: 0 [2q] [2n] ANY (QM)? Android-3.local. ANY (QM)? Android-3.local. (83)
11:31:24.864750 ARP, Request who-has mbpc525.eduroam.umg.edu.pl tell fgw.eduroam.umg.edu.pl, length 46
11:31:24.865482 IP Air-Katarzyna.umg.edu.pl.mdns > 224.0.0.251.mdns: 0 [4q] [5n] [1au] ANY (QU)? MacBook Air (Katarzyna)._airplay._tcp.local. ANY (QU)? 147DDA9962C1@MacBook Air (Katarzyna)._raop._tcp.local. ANY (QU)? MacBook Air (Katarzyna)._companion-link._tcp.local. ANY (QU)? MacBook-Air-Katarzyna.local. (317)
11:31:24.866121 IP6 fe80::104a:2fa4:c6d3:1512.mdns > ff02::fb.mdns: 0 [4q] [5n] [1au] ANY (QU)? MacBook Air (Katarzyna)._airplay._tcp.local. ANY (QU)? 147DDA9962C1@MacBook Air (Katarzyna)._raop._tcp.local. ANY (QU)? MacBook Air (Katarzyna)._companion-link._tcp.local. ANY (QU)? MacBook-Air-Katarzyna.local. (317)
11:31:24.866803 IP6 fe80::104a:2fa4:c6d3:1512.mdns > ff02::fb.mdns: 0 [4q] [5n] [1au] ANY (QU)? MacBook Air (Katarzyna)._airplay._tcp.local. ANY (QU)? 147DDA9962C1@MacBook Air (Katarzyna)._raop._tcp.local. ANY (QU)? MacBook Air (Katarzyna)._companion-link._tcp.local. ANY (QU)? MacBook-Air-Katarzyna.local. (317)
11:31:24.867112 IP M2003J15SC-RedmiNote.umg.edu.pl.mdns > 224.0.0.251.mdns: 0*- [0q] 1/0/1 (Cache flush) A 153.19.114.58 (61)
11:31:24.867412 IP6 fe80::301b:f8ff:fe26:baae.mdns > ff02::fb.mdns: 0*- [0q] 1/0/1 (Cache flush) A 153.19.114.58 (61)
11:31:24.867743 IP6 fe80::301b:f8ff:fe26:baae.mdns > ff02::fb.mdns: 0*- [0q] 1/0/1 (Cache flush) A 153.19.114.58 (61)
11:31:24.868286 IP DESKTOP-ED4GRAD.umg.edu.pl.58870 > 239.255.255.250.1900: UDP, length 175
11:31:24.868307 ARP, Request who-has Air-Katarzyna.umg.edu.pl tell mbpc426.eduroam.umg.edu.pl, length 42
11:31:24.868865 IP DESKTOP-ED4GRAD.umg.edu.pl.58871 > 239.255.255.250.1900: UDP, length 174
11:31:24.869201 IP HUAWEI_P30_Pro-bee164877a.umg.edu.pl.mdns > 224.0.0.251.mdns: 0 [2q] [2n] ANY (QM)? Android-3.local. ANY (QM)? Android-3.local. (83)
11:31:24.869496 IP6 fe80::ef9a:1048:c1ca:3c97.mdns > ff02::fb.mdns: 0 [2q] [2n] ANY (QM)? Android-3.local. ANY (QM)? Android-3.local. (83)
11:31:24.869948 IP6 fe80::ef9a:1048:c1ca:3c97.mdns > ff02::fb.mdns: 0 [2q] [2n] ANY (QM)? Android-3.local. ANY (QM)? Android-3.local. (83)
11:31:24.870282 IP Air-Katarzyna.umg.edu.pl.netbios-ns > 153.19.115.255.netbios-ns: UDP, length 50
11:31:24.870631 IP6 fe80::ef9a:1048:c1ca:3c97.mdns > ff02::fb.mdns: 0 [2q] [2n] ANY (QM)? Android-3.local. ANY (QM)? Android-3.local. (83)
11:31:25.135704 IP jan-IdeaPad-L340-15IRH.umg.edu.pl.53842 > fgw.eduroam.umg.edu.pl.domain: 42524+ PTR? d.b.2.e.1.5.e.f.f.f.6.4.0.5.6.a.0.0.0.0.0.0.0.0.0.0.0.0.0.8.e.f.ip6.arpa. (90)
11:31:25.141280 IP fgw.eduroam.umg.edu.pl.domain > jan-IdeaPad-L340-15IRH.umg.edu.pl.53842: 42524 NXDomain* 0/1/0 (139)
11:31:25.142992 IP jan-IdeaPad-L340-15IRH.umg.edu.pl.37808 > fgw.eduroam.umg.edu.pl.domain: 19757+ PTR? 230.115.19.153.in-addr.arpa. (45)
11:31:25.146901 IP fgw.eduroam.umg.edu.pl.domain > jan-IdeaPad-L340-15IRH.umg.edu.pl.37808: 19757* 1/4/4 PTR mbpc5230.eduroam.umg.edu.pl. (262)
11:31:25.147992 IP jan-IdeaPad-L340-15IRH.umg.edu.pl.56733 > fgw.eduroam.umg.edu.pl.domain: 15386+ PTR? 160.114.19.153.in-addr.arpa. (45)
11:31:25.150345 IP fgw.eduroam.umg.edu.pl.domain > jan-IdeaPad-L340-15IRH.umg.edu.pl.56733: 15386* 1/0/0 PTR Air-Katarzyna.umg.edu.pl. (83)
11:31:25.151778 IP jan-IdeaPad-L340-15IRH.umg.edu.pl.55282 > fgw.eduroam.umg.edu.pl.domain: 44222+ PTR? 2.1.5.1.3.d.6.c.4.a.f.2.a.4.0.1.0.0.0.0.0.0.0.0.0.0.0.0.0.8.e.f.ip6.arpa. (90)
11:31:25.154326 IP fgw.eduroam.umg.edu.pl.domain > jan-IdeaPad-L340-15IRH.umg.edu.pl.55282: 44222 NXDomain* 0/1/0 (139)
11:31:25.156038 IP jan-IdeaPad-L340-15IRH.umg.edu.pl.50388 > fgw.eduroam.umg.edu.pl.domain: 62563+ PTR? 167.115.19.153.in-addr.arpa. (45)
11:31:25.158388 IP fgw.eduroam.umg.edu.pl.domain > jan-IdeaPad-L340-15IRH.umg.edu.pl.50388: 62563* 1/0/0 PTR DESKTOP-4S4I5AP.umg.edu.pl. (85)
11:31:25.160637 IP jan-IdeaPad-L340-15IRH.umg.edu.pl.44371 > fgw.eduroam.umg.edu.pl.domain: 13220+ PTR? b.6.8.6.5.b.a.f.b.8.3.4.b.0.0.0.0.0.0.0.0.0.0.0.0.0.0.0.0.8.e.f.ip6.arpa. (90)
11:31:25.163214 IP fgw.eduroam.umg.edu.pl.domain > jan-IdeaPad-L340-15IRH.umg.edu.pl.44371: 13220 NXDomain* 0/1/0 (139)
11:31:25.165114 IP jan-IdeaPad-L340-15IRH.umg.edu.pl.39010 > fgw.eduroam.umg.edu.pl.domain: 10231+ PTR? 25.115.19.153.in-addr.arpa. (44)
11:31:25.169150 IP6 fe80::ef9a:1048:c1ca:3c97.mdns > ff02::fb.mdns: 0 [2q] [2n] ANY (QM)? Android-3.local. ANY (QM)? Android-3.local. (83)
11:31:25.169357 ARP, Request who-has mbpc5110.eduroam.umg.edu.pl tell fgw.eduroam.umg.edu.pl, length 46
11:31:25.169953 IP DESKTOP-MBRAJCB.umg.edu.pl.54915 > 153.19.115.255.54915: UDP, length 263
11:31:25.170355 IP DESKTOP-4S4I5AP.umg.edu.pl.netbios-ns > 153.19.115.255.netbios-ns: UDP, length 50
11:31:25.170615 IP LAPTOP-C8790SDD.umg.edu.pl.63459 > 224.0.0.252.hostmon: UDP, length 33
11:31:25.171030 IP6 fe80::f19b:6327:f3a8:e155.63459 > ff02::1:3.hostmon: UDP, length 33
11:31:25.171274 IP Air-Katarzyna.umg.edu.pl.netbios-ns > 153.19.115.255.netbios-ns: UDP, length 50
11:31:25.171880 IP Air-Katarzyna.umg.edu.pl.mdns > 224.0.0.251.mdns: 0 [4q] [5n] [1au] ANY (QM)? MacBook Air (Katarzyna)._airplay._tcp.local. ANY (QM)? 147DDA9962C1@MacBook Air (Katarzyna)._raop._tcp.local. ANY (QM)? MacBook Air (Katarzyna)._companion-link._tcp.local. ANY (QM)? MacBook-Air-Katarzyna.local. (317)
11:31:25.172636 IP6 fe80::104a:2fa4:c6d3:1512.mdns > ff02::fb.mdns: 0 [4q] [5n] [1au] ANY (QM)? MacBook Air (Katarzyna)._airplay._tcp.local. ANY (QM)? 147DDA9962C1@MacBook Air (Katarzyna)._raop._tcp.local. ANY (QM)? MacBook Air (Katarzyna)._companion-link._tcp.local. ANY (QM)? MacBook-Air-Katarzyna.local. (317)
11:31:25.173350 IP6 fe80::104a:2fa4:c6d3:1512.mdns > ff02::fb.mdns: 0 [4q] [5n] [1au] ANY (QM)? MacBook Air (Katarzyna)._airplay._tcp.local. ANY (QM)? 147DDA9962C1@MacBook Air (Katarzyna)._raop._tcp.local. ANY (QM)? MacBook Air (Katarzyna)._companion-link._tcp.local. ANY (QM)? MacBook-Air-Katarzyna.local. (317)
11:31:25.173864 IP mbpc4135.eduroam.umg.edu.pl.mdns > 224.0.0.251.mdns: 0*- [0q] 4/0/3 (Cache flush) PTR Android-40.local., (Cache flush) PTR Android-40.local., (Cache flush) A 153.19.114.135, (Cache flush) AAAA fe80::aa9c:edff:fee1:dd54 (251)
11:31:25.174433 IP6 fe80::aa9c:edff:fee1:dd54.mdns > ff02::fb.mdns: 0*- [0q] 4/0/3 (Cache flush) PTR Android-40.local., (Cache flush) PTR Android-40.local., (Cache flush) A 153.19.114.135, (Cache flush) AAAA fe80::aa9c:edff:fee1:dd54 (251)
11:31:25.175081 IP6 fe80::aa9c:edff:fee1:dd54.mdns > ff02::fb.mdns: 0*- [0q] 4/0/3 (Cache flush) PTR Android-40.local., (Cache flush) PTR Android-40.local., (Cache flush) A 153.19.114.135, (Cache flush) AAAA fe80::aa9c:edff:fee1:dd54 (251)
11:31:25.175602 IP HUAWEI_P30_Pro-bee164877a.umg.edu.pl.mdns > 224.0.0.251.mdns: 0*- [0q] 4/0/3 (Cache flush) PTR Android-3.local., (Cache flush) PTR Android-3.local., (Cache flush) A 153.19.115.174, (Cache flush) AAAA fe80::ef9a:1048:c1ca:3c97 (250)
11:31:25.176205 IP6 fe80::ef9a:1048:c1ca:3c97.mdns > ff02::fb.mdns: 0*- [0q] 4/0/3 (Cache flush) PTR Android-3.local., (Cache flush) PTR Android-3.local., (Cache flush) A 153.19.115.174, (Cache flush) AAAA fe80::ef9a:1048:c1ca:3c97 (250)
11:31:25.176457 ARP, Request who-has OnePlus-6.umg.edu.pl tell fgw.eduroam.umg.edu.pl, length 46
11:31:25.177064 IP6 fe80::ef9a:1048:c1ca:3c97.mdns > ff02::fb.mdns: 0*- [0q] 4/0/3 (Cache flush) PTR Android-3.local., (Cache flush) PTR Android-3.local., (Cache flush) A 153.19.115.174, (Cache flush) AAAA fe80::ef9a:1048:c1ca:3c97 (250)
11:31:25.177715 IP6 fe80::ef9a:1048:c1ca:3c97.mdns > ff02::fb.mdns: 0*- [0q] 4/0/3 (Cache flush) PTR Android-3.local., (Cache flush) PTR Android-3.local., (Cache flush) A 153.19.115.174, (Cache flush) AAAA fe80::ef9a:1048:c1ca:3c97 (250)
11:31:25.178254 IP Air-Katarzyna.umg.edu.pl.mdns > 224.0.0.251.mdns: 0*- [0q] 2/0/3 (Cache flush) PTR MacBook-Air-Katarzyna.local., (Cache flush) PTR MacBook-Air-Katarzyna.local. (227)
11:31:25.179329 IP6 fe80::104a:2fa4:c6d3:1512.mdns > ff02::fb.mdns: 0*- [0q] 2/0/3 (Cache flush) PTR MacBook-Air-Katarzyna.local., (Cache flush) PTR MacBook-Air-Katarzyna.local. (227)
11:31:25.179923 IP6 fe80::ef9a:1048:c1ca:3c97.mdns > ff02::fb.mdns: 0*- [0q] 4/0/3 (Cache flush) PTR Android-3.local., (Cache flush) PTR Android-3.local., (Cache flush) A 153.19.115.174, (Cache flush) AAAA fe80::ef9a:1048:c1ca:3c97 (250)
11:31:25.180452 IP6 fe80::104a:2fa4:c6d3:1512.mdns > ff02::fb.mdns: 0*- [0q] 2/0/3 (Cache flush) PTR MacBook-Air-Katarzyna.local., (Cache flush) PTR MacBook-Air-Katarzyna.local. (227)
11:31:25.180553 IP fgw.eduroam.umg.edu.pl.domain > jan-IdeaPad-L340-15IRH.umg.edu.pl.39010: 10231* 1/4/4 PTR mbpc525.eduroam.umg.edu.pl. (259)
11:31:25.278991 IP jan-IdeaPad-L340-15IRH.umg.edu.pl.37190 > ec2-99-81-9-165.eu-west-1.compute.amazonaws.com.https: Flags [P.], seq 918374046:918374171, ack 2336743998, win 2123, options [nop,nop,TS val 2065948430 ecr 2907922032], length 125
11:31:25.371792 IP ec2-99-81-9-165.eu-west-1.compute.amazonaws.com.https > jan-IdeaPad-L340-15IRH.umg.edu.pl.37190: Flags [.], ack 125, win 425, options [nop,nop,TS val 2907926067 ecr 2065948430], length 0
11:31:25.378811 IP ec2-99-81-9-165.eu-west-1.compute.amazonaws.com.https > jan-IdeaPad-L340-15IRH.umg.edu.pl.37190: Flags [.], seq 1:1449, ack 125, win 425, options [nop,nop,TS val 2907926074 ecr 2065948430], length 1448
11:31:25.378853 IP jan-IdeaPad-L340-15IRH.umg.edu.pl.37190 > ec2-99-81-9-165.eu-west-1.compute.amazonaws.com.https: Flags [.], ack 1449, win 2123, options [nop,nop,TS val 2065948530 ecr 2907926074], length 0
11:31:25.378953 IP ec2-99-81-9-165.eu-west-1.compute.amazonaws.com.https > jan-IdeaPad-L340-15IRH.umg.edu.pl.37190: Flags [P.], seq 1449:2350, ack 125, win 425, options [nop,nop,TS val 2907926074 ecr 2065948430], length 901
11:31:25.378968 IP jan-IdeaPad-L340-15IRH.umg.edu.pl.37190 > ec2-99-81-9-165.eu-west-1.compute.amazonaws.com.https: Flags [.], ack 2350, win 2116, options [nop,nop,TS val 2065948530 ecr 2907926074], length 0
11:31:25.379080 IP ec2-99-81-9-165.eu-west-1.compute.amazonaws.com.https > jan-IdeaPad-L340-15IRH.umg.edu.pl.37190: Flags [P.], seq 2350:2388, ack 125, win 425, options [nop,nop,TS val 2907926074 ecr 2065948430], length 38
11:31:25.379090 IP jan-IdeaPad-L340-15IRH.umg.edu.pl.37190 > ec2-99-81-9-165.eu-west-1.compute.amazonaws.com.https: Flags [.], ack 2388, win 2123, options [nop,nop,TS val 2065948530 ecr 2907926074], length 0
11:31:25.476716 IP Air-Katarzyna.umg.edu.pl.mdns > 224.0.0.251.mdns: 0 [4q] [5n] [1au] ANY (QM)? MacBook Air (Katarzyna)._airplay._tcp.local. ANY (QM)? 147DDA9962C1@MacBook Air (Katarzyna)._raop._tcp.local. ANY (QM)? MacBook Air (Katarzyna)._companion-link._tcp.local. ANY (QM)? MacBook-Air-Katarzyna.local. (317)
11:31:25.477360 IP6 fe80::104a:2fa4:c6d3:1512.mdns > ff02::fb.mdns: 0 [4q] [5n] [1au] ANY (QM)? MacBook Air (Katarzyna)._airplay._tcp.local. ANY (QM)? 147DDA9962C1@MacBook Air (Katarzyna)._raop._tcp.local. ANY (QM)? MacBook Air (Katarzyna)._companion-link._tcp.local. ANY (QM)? MacBook-Air-Katarzyna.local. (317)
11:31:25.478045 IP6 fe80::104a:2fa4:c6d3:1512.mdns > ff02::fb.mdns: 0 [4q] [5n] [1au] ANY (QM)? MacBook Air (Katarzyna)._airplay._tcp.local. ANY (QM)? 147DDA9962C1@MacBook Air (Katarzyna)._raop._tcp.local. ANY (QM)? MacBook Air (Katarzyna)._companion-link._tcp.local. ANY (QM)? MacBook-Air-Katarzyna.local. (317)
11:31:25.478357 IP mbpc4159.eduroam.umg.edu.pl.mdns > 224.0.0.251.mdns: 0 PTR (QM)? _spotify-connect._tcp.local. (45)
11:31:25.478619 IP LAPTOP-C8790SDD.umg.edu.pl.netbios-ns > 153.19.115.255.netbios-ns: UDP, length 50
11:31:25.478875 IP6 fe80::14b1:7f82:70fc:edf1.mdns > ff02::fb.mdns: 0 PTR (QM)? _spotify-connect._tcp.local. (45)
11:31:25.479183 IP6 fe80::14b1:7f82:70fc:edf1.mdns > ff02::fb.mdns: 0 PTR (QM)? _spotify-connect._tcp.local. (45)
11:31:25.479426 IP LAPTOP-C8790SDD.umg.edu.pl.netbios-ns > 153.19.115.255.netbios-ns: UDP, length 50
11:31:25.479681 IP LAPTOP-C8790SDD.umg.edu.pl.mdns > 224.0.0.251.mdns: 0 A (QM)? BRW30C9AB055211.local. (39)
11:31:25.480121 IP6 fe80::f19b:6327:f3a8:e155.mdns > ff02::fb.mdns: 0 A (QM)? BRW30C9AB055211.local. (39)
11:31:25.480342 IP LAPTOP-C8790SDD.umg.edu.pl.65004 > 224.0.0.252.hostmon: UDP, length 33
11:31:25.480668 IP6 fe80::f19b:6327:f3a8:e155.mdns > ff02::fb.mdns: 0 A (QM)? BRW30C9AB055211.local. (39)
11:31:25.480769 IP6 fe80::f19b:6327:f3a8:e155.65004 > ff02::1:3.hostmon: UDP, length 33
11:31:25.481946 IP Air-Katarzyna.umg.edu.pl.mdns > 224.0.0.251.mdns: 0 [4a] [23q] [1au] PTR (QM)? lb._dns-sd._udp.local. PTR (QM)? _airport._tcp.local. PTR (QM)? _homekit._tcp.local. PTR (QM)? _googlecast._tcp.local. PTR (QM)? _rdlink._tcp.local. PTR (QM)? _uscans._tcp.local. PTR (QM)? _scanner._tcp.local. PTR (QM)? _ipp._tcp.local. PTR (QM)? _ptp._tcp.local. PTR (QM)? _printer._tcp.local. PTR (QM)? _ipps._tcp.local. PTR (QM)? _ippusb._tcp.local. PTR (QM)? _pdl-datastream._tcp.local. PTR (QM)? _uscan._tcp.local. PTR (QM)? _afpovertcp._tcp.local. PTR (QM)? _smb._tcp.local. PTR (QM)? _rfb._tcp.local. PTR (QM)? _adisk._tcp.local. PTR (QM)? _companion-link._tcp.local. PTR (QM)? _sleep-proxy._udp.local. PTR (QM)? _apple-mobdev._tcp.local. PTR (QM)? 8b4507c7._sub._apple-mobdev2._tcp.local. PTR (QM)? _apple-pairable._tcp.local. (556)
11:31:25.482961 IP6 fe80::104a:2fa4:c6d3:1512.mdns > ff02::fb.mdns: 0 [4a] [23q] [1au] PTR (QM)? lb._dns-sd._udp.local. PTR (QM)? _airport._tcp.local. PTR (QM)? _homekit._tcp.local. PTR (QM)? _googlecast._tcp.local. PTR (QM)? _rdlink._tcp.local. PTR (QM)? _uscans._tcp.local. PTR (QM)? _scanner._tcp.local. PTR (QM)? _ipp._tcp.local. PTR (QM)? _ptp._tcp.local. PTR (QM)? _printer._tcp.local. PTR (QM)? _ipps._tcp.local. PTR (QM)? _ippusb._tcp.local. PTR (QM)? _pdl-datastream._tcp.local. PTR (QM)? _uscan._tcp.local. PTR (QM)? _afpovertcp._tcp.local. PTR (QM)? _smb._tcp.local. PTR (QM)? _rfb._tcp.local. PTR (QM)? _adisk._tcp.local. PTR (QM)? _companion-link._tcp.local. PTR (QM)? _sleep-proxy._udp.local. PTR (QM)? _apple-mobdev._tcp.local. PTR (QM)? 8b4507c7._sub._apple-mobdev2._tcp.local. PTR (QM)? _apple-pairable._tcp.local. (556)
11:31:25.483857 IP6 fe80::104a:2fa4:c6d3:1512.mdns > ff02::fb.mdns: 0 [4a] [23q] [1au] PTR (QM)? lb._dns-sd._udp.local. PTR (QM)? _airport._tcp.local. PTR (QM)? _homekit._tcp.local. PTR (QM)? _googlecast._tcp.local. PTR (QM)? _rdlink._tcp.local. PTR (QM)? _uscans._tcp.local. PTR (QM)? _scanner._tcp.local. PTR (QM)? _ipp._tcp.local. PTR (QM)? _ptp._tcp.local. PTR (QM)? _printer._tcp.local. PTR (QM)? _ipps._tcp.local. PTR (QM)? _ippusb._tcp.local. PTR (QM)? _pdl-datastream._tcp.local. PTR (QM)? _uscan._tcp.local. PTR (QM)? _afpovertcp._tcp.local. PTR (QM)? _smb._tcp.local. PTR (QM)? _rfb._tcp.local. PTR (QM)? _adisk._tcp.local. PTR (QM)? _companion-link._tcp.local. PTR (QM)? _sleep-proxy._udp.local. PTR (QM)? _apple-mobdev._tcp.local. PTR (QM)? 8b4507c7._sub._apple-mobdev2._tcp.local. PTR (QM)? _apple-pairable._tcp.local. (556)
11:31:25.484262 IP DESKTOP-BJSFL79.umg.edu.pl.58026 > 239.255.255.250.1900: UDP, length 137
11:31:25.783641 IP Air-Katarzyna.umg.edu.pl.netbios-ns > 153.19.115.255.netbios-ns: UDP, length 50
11:31:25.783993 IP Air-Katarzyna.umg.edu.pl.netbios-ns > 153.19.115.255.netbios-ns: UDP, length 50
11:31:25.784101 IP LAPTOP-C8790SDD.umg.edu.pl.mdns > 224.0.0.251.mdns: 0 A (QM)? BRW30C9AB055211.local. (39)
11:31:25.784597 IP6 fe80::f19b:6327:f3a8:e155.mdns > ff02::fb.mdns: 0 A (QM)? BRW30C9AB055211.local. (39)
11:31:25.784873 IP6 fe80::f19b:6327:f3a8:e155.mdns > ff02::fb.mdns: 0 A (QM)? BRW30C9AB055211.local. (39)
11:31:25.785252 IP mbpc4159.eduroam.umg.edu.pl.62012 > 239.255.255.250.1900: UDP, length 125
11:31:25.785318 ARP, Request who-has DESKTOP-BJSFL79.umg.edu.pl tell DESKTOP-BJSFL79.umg.edu.pl, length 42
11:31:25.785648 ARP, Request who-has Komputer.umg.edu.pl tell fgw.eduroam.umg.edu.pl, length 46
11:31:25.786285 IP HUAWEI_Mate_20-e651010fc6.umg.edu.pl.mdns > 224.0.0.251.mdns: 0*- [0q] 4/0/3 (Cache flush) PTR Android-4.local., (Cache flush) PTR Android-4.local., (Cache flush) A 153.19.115.0, (Cache flush) AAAA fe80::27b5:10c4:a7b3:e9f (248)
11:31:25.786925 IP6 fe80::27b5:10c4:a7b3:e9f.mdns > ff02::fb.mdns: 0*- [0q] 4/0/3 (Cache flush) PTR Android-4.local., (Cache flush) PTR Android-4.local., (Cache flush) A 153.19.115.0, (Cache flush) AAAA fe80::27b5:10c4:a7b3:e9f (248)
11:31:25.788863 IP Air-Katarzyna.umg.edu.pl.mdns > 224.0.0.251.mdns: 0*- [0q] 15/0/5 (Cache flush) TXT "act=2" "acl=0" "deviceid=14:7D:DA:99:62:C1" "fex=1c9/St5PFbgG" "features=0x4A7FCFD5,0xB8154FDE" "rsf=0x8" "flags=0x204" "gid=B122895A-FBB7-425B-99AA-F4F1C0220DD0" "igl=0" "gcgl=0" "model=MacBookAir9,1" "at=4" "protovers=1.1" "pi=08e6d08e-9c80-4990-9764-b35855db4a16" "psi=8F240D26-303E-4F03-B07A-2F8269AADF93" "pk=2874f394bdf5756280835e849639bbf670bc9550733a13fcdec4e3885c0ff558" "srcvers=605.1", PTR _airplay._tcp.local., PTR MacBook Air (Katarzyna)._airplay._tcp.local., (Cache flush) TXT "cn=0,1,2,3" "da=true" "et=0,3,5" "ft=0x4A7FCFD5,0xB8154FDE" "sf=0x204" "md=0,1,2" "am=MacBookAir9,1" "pk=2874f394bdf5756280835e849639bbf670bc9550733a13fcdec4e3885c0ff558" "tp=UDP" "vn=65537" "vs=605.1" "vv=0", PTR _raop._tcp.local., PTR 147DDA9962C1@MacBook Air (Katarzyna)._raop._tcp.local., (Cache flush) SRV MacBook-Air-Katarzyna.local.:7000 0 0, (Cache flush) SRV MacBook-Air-Katarzyna.local.:7000 0 0, (Cache flush) TXT "rpBA=03:FE:DD:71:0C:1A" "rpAD=33b34deaeaf6" "rpFl=0x20000" "rpHN=a2fa4e7d19c6" "rpMac=0" "rpVr=330.5", PTR _companion-link._tcp.local., PTR MacBook Air (Katarzyna)._companion-link._tcp.local., TXT "model=MacBookAir9,1" "osxvers=21" "ecolor=157,157,160", (Cache flush) SRV MacBook-Air-Katarzyna.local.:49700 0 0, (Cache flush) AAAA fe80::104a:2fa4:c6d3:1512, (Cache flush) A 153.19.114.160 (1258)
11:31:25.789396 IP6 fe80::27b5:10c4:a7b3:e9f.mdns > ff02::fb.mdns: 0*- [0q] 4/0/3 (Cache flush) PTR Android-4.local., (Cache flush) PTR Android-4.local., (Cache flush) A 153.19.115.0, (Cache flush) AAAA fe80::27b5:10c4:a7b3:e9f (248)
11:31:25.789732 IP DESKTOP-4S4I5AP.umg.edu.pl.netbios-ns > 153.19.115.255.netbios-ns: UDP, length 50
11:31:25.791708 IP6 fe80::104a:2fa4:c6d3:1512.mdns > ff02::fb.mdns: 0*- [0q] 15/0/5 (Cache flush) TXT "act=2" "acl=0" "deviceid=14:7D:DA:99:62:C1" "fex=1c9/St5PFbgG" "features=0x4A7FCFD5,0xB8154FDE" "rsf=0x8" "flags=0x204" "gid=B122895A-FBB7-425B-99AA-F4F1C0220DD0" "igl=0" "gcgl=0" "model=MacBookAir9,1" "at=4" "protovers=1.1" "pi=08e6d08e-9c80-4990-9764-b35855db4a16" "psi=8F240D26-303E-4F03-B07A-2F8269AADF93" "pk=2874f394bdf5756280835e849639bbf670bc9550733a13fcdec4e3885c0ff558" "srcvers=605.1", PTR _airplay._tcp.local., PTR MacBook Air (Katarzyna)._airplay._tcp.local., (Cache flush) TXT "cn=0,1,2,3" "da=true" "et=0,3,5" "ft=0x4A7FCFD5,0xB8154FDE" "sf=0x204" "md=0,1,2" "am=MacBookAir9,1" "pk=2874f394bdf5756280835e849639bbf670bc9550733a13fcdec4e3885c0ff558" "tp=UDP" "vn=65537" "vs=605.1" "vv=0", PTR _raop._tcp.local., PTR 147DDA9962C1@MacBook Air (Katarzyna)._raop._tcp.local., (Cache flush) SRV MacBook-Air-Katarzyna.local.:7000 0 0, (Cache flush) SRV MacBook-Air-Katarzyna.local.:7000 0 0, (Cache flush) TXT "rpBA=03:FE:DD:71:0C:1A" "rpAD=33b34deaeaf6" "rpFl=0x20000" "rpHN=a2fa4e7d19c6" "rpMac=0" "rpVr=330.5", PTR _companion-link._tcp.local., PTR MacBook Air (Katarzyna)._companion-link._tcp.local., TXT "model=MacBookAir9,1" "osxvers=21" "ecolor=157,157,160", (Cache flush) SRV MacBook-Air-Katarzyna.local.:49700 0 0, (Cache flush) AAAA fe80::104a:2fa4:c6d3:1512, (Cache flush) A 153.19.114.160 (1258)
